{
  "schema_version": "1.0",
  "analytics_id": "analytics_sim_001",
  "request_id": "sim_001",
  "portfolio_id": "demo_ethena_01",
  "scenario_id": "usde_depeg",
  "horizon_days": 7,
  "currency": "USD",
  "headline": {
    "nav_usd": "6200055.14",
    "scenario_loss_usd": "523320.57",
    "scenario_loss_pct_nav": "0.0844",
    "usde_exposure_usd": "10000055.14",
    "usde_effective_leverage": "1.6129",
    "derisking_savings_usd": "6650.51",
    "derisking_savings_bps_nav": "10.7265",
    "liquidation_protection_net_benefit_usd": "0.00",
    "targeted_plan_break_even_probability": "0.1937",
    "top_risk_driver": "USDe depeg size"
  },
  "factor_exposure": [
    {
      "factor": "usde_price",
      "loss_usd": "100000.55",
      "unit": "per 1% USDe price drop",
      "exposure_usd": "10000055.14",
      "effective_leverage": "1.6129",
      "positions_exposed": [
        "aave_01",
        "ethena_susde_01",
        "morpho_01",
        "pendle_01"
      ],
      "loss_by_position_usd": {
        "ethena_susde_01": "20000.00",
        "aave_01": "30000.00",
        "morpho_01": "30000.00",
        "pendle_01": "20000.55"
      }
    },
    {
      "factor": "usde_backing",
      "loss_usd": "100000.55",
      "unit": "per 1% USDe backing loss",
      "exposure_usd": "10000055.14",
      "effective_leverage": "1.6129",
      "positions_exposed": [
        "aave_01",
        "ethena_susde_01",
        "morpho_01",
        "pendle_01"
      ],
      "loss_by_position_usd": {
        "ethena_susde_01": "20000.00",
        "aave_01": "30000.00",
        "morpho_01": "30000.00",
        "pendle_01": "20000.55"
      }
    },
    {
      "factor": "susde_exchange_rate",
      "loss_usd": "70000.55",
      "unit": "per 1% sUSDe rate cut",
      "exposure_usd": "7000055.14",
      "effective_leverage": "1.1290",
      "positions_exposed": [
        "ethena_susde_01",
        "morpho_01",
        "pendle_01"
      ],
      "loss_by_position_usd": {
        "ethena_susde_01": "20000.00",
        "aave_01": "0.00",
        "morpho_01": "30000.00",
        "pendle_01": "20000.55"
      }
    },
    {
      "factor": "pt_implied_yield",
      "loss_usd": "8289.81",
      "unit": "per +100bp PT implied yield",
      "exposure_usd": "828980.86",
      "effective_leverage": "0.1337",
      "positions_exposed": [
        "pendle_01"
      ],
      "loss_by_position_usd": {
        "ethena_susde_01": "0.00",
        "aave_01": "0.00",
        "morpho_01": "0.00",
        "pendle_01": "8289.81"
      }
    }
  ],
  "breaking_points": {
    "liquidation": [
      {
        "position_id": "aave_01",
        "mechanism": "usde_market_depeg",
        "breaks_at_shock_pct": "-0.2941",
        "immune": false
      },
      {
        "position_id": "aave_01",
        "mechanism": "usde_backing_loss",
        "breaks_at_shock_pct": "-0.2941",
        "immune": false
      },
      {
        "position_id": "aave_01",
        "mechanism": "susde_rate_cut",
        "breaks_at_shock_pct": null,
        "immune": true
      },
      {
        "position_id": "morpho_01",
        "mechanism": "usde_market_depeg",
        "breaks_at_shock_pct": null,
        "immune": true
      },
      {
        "position_id": "morpho_01",
        "mechanism": "usde_backing_loss",
        "breaks_at_shock_pct": null,
        "immune": true
      },
      {
        "position_id": "morpho_01",
        "mechanism": "susde_rate_cut",
        "breaks_at_shock_pct": "-0.2714",
        "immune": false
      }
    ],
    "nav_drawdown": [
      {
        "nav_drawdown_pct": "0.1000",
        "usde_depeg_pct": "-0.0620",
        "usde_price": "0.9380"
      },
      {
        "nav_drawdown_pct": "0.2000",
        "usde_depeg_pct": "-0.1240",
        "usde_price": "0.8760"
      },
      {
        "nav_drawdown_pct": "0.5000",
        "usde_depeg_pct": "-0.3055",
        "usde_price": "0.6945"
      }
    ]
  },
  "derisking": {
    "target_loss_reduction_pct": "0.5000",
    "stress_loss_usd": "523320.57",
    "uniform": {
      "plan": "uniform",
      "fractions": {
        "ethena_susde_01": "0.5000",
        "aave_01": "0.5000",
        "morpho_01": "0.5000",
        "pendle_01": "0.5000"
      },
      "loss_reduction_usd": "261660.29",
      "trading_cost_usd": "55833.27",
      "foregone_yield_usd": "2502.79",
      "total_cost_usd": "58336.05",
      "break_even_probability": "0.2229"
    },
    "targeted": {
      "plan": "targeted",
      "fractions": {
        "ethena_susde_01": "0.0000",
        "aave_01": "0.8500",
        "morpho_01": "0.6000",
        "pendle_01": "0.4000"
      },
      "loss_reduction_usd": "266828.23",
      "trading_cost_usd": "50739.06",
      "foregone_yield_usd": "946.48",
      "total_cost_usd": "51685.54",
      "break_even_probability": "0.1937"
    },
    "full_exit": {
      "plan": "full_exit",
      "fractions": {
        "ethena_susde_01": "1.0000",
        "aave_01": "1.0000",
        "morpho_01": "1.0000",
        "pendle_01": "1.0000"
      },
      "loss_reduction_usd": "523320.57",
      "trading_cost_usd": "210597.39",
      "foregone_yield_usd": "5005.57",
      "total_cost_usd": "215602.96",
      "break_even_probability": "0.4120"
    },
    "savings_usd": "6650.51",
    "savings_pct_of_uniform_cost": "0.1140",
    "savings_bps_nav": "10.7265",
    "cost_per_usd_protected": {
      "ethena_susde_01": "0.2453",
      "aave_01": "0.2248",
      "morpho_01": "0.3018",
      "pendle_01": "0.4401"
    }
  },
  "liquidation_protection": [],
  "sensitivity": {
    "tornado": [
      {
        "assumption": "USDe depeg size",
        "target": "usde_spot_shock_pct",
        "low_value": "-0.0250",
        "high_value": "-0.1000",
        "loss_at_low_usd": "273932.82",
        "loss_at_high_usd": "1022096.08",
        "swing_usd": "748163.26",
        "base_loss_usd": "523320.57"
      },
      {
        "assumption": "USDe backing loss",
        "target": "backing_impairment_pct",
        "low_value": "0.0000",
        "high_value": "-0.0500",
        "loss_at_low_usd": "523320.57",
        "loss_at_high_usd": "997157.30",
        "swing_usd": "473836.73",
        "base_loss_usd": "523320.57"
      },
      {
        "assumption": "sUSDe exchange-rate cut",
        "target": "susde_rate_cut_pct",
        "low_value": "0.0000",
        "high_value": "-0.0500",
        "loss_at_low_usd": "523320.57",
        "loss_at_high_usd": "854657.30",
        "swing_usd": "331336.73",
        "base_loss_usd": "523320.57"
      },
      {
        "assumption": "sUSDe beta to USDe",
        "target": "susde_market_beta",
        "low_value": "0.5000",
        "high_value": "1.5000",
        "loss_at_low_usd": "398320.57",
        "loss_at_high_usd": "648320.57",
        "swing_usd": "250000.00",
        "base_loss_usd": "523320.57"
      },
      {
        "assumption": "PT implied yield shock",
        "target": "pt_implied_apy_shock",
        "low_value": "0.0000",
        "high_value": "0.0600",
        "loss_at_low_usd": "500002.76",
        "loss_at_high_usd": "545747.04",
        "swing_usd": "45744.28",
        "base_loss_usd": "523320.57"
      },
      {
        "assumption": "pendle_01 PT implied APY",
        "target": "pendle_01.pt_implied_apy",
        "low_value": "0.0600",
        "high_value": "0.1200",
        "loss_at_low_usd": "525550.78",
        "loss_at_high_usd": "521201.97",
        "swing_usd": "4348.81",
        "base_loss_usd": "523320.57"
      },
      {
        "assumption": "Oracle pass-through (all markets)",
        "target": "oracle_pass_through_override",
        "low_value": "0.0000",
        "high_value": "1.0000",
        "loss_at_low_usd": "523320.57",
        "loss_at_high_usd": "523320.57",
        "swing_usd": "0.00",
        "base_loss_usd": "523320.57"
      },
      {
        "assumption": "aave_01 liquidation threshold",
        "target": "aave_01.liquidation_threshold",
        "low_value": "0.8000",
        "high_value": "0.8800",
        "loss_at_low_usd": "523320.57",
        "loss_at_high_usd": "523320.57",
        "swing_usd": "0.00",
        "base_loss_usd": "523320.57"
      },
      {
        "assumption": "morpho_01 LLTV",
        "target": "morpho_01.lltv",
        "low_value": "0.8650",
        "high_value": "0.9450",
        "loss_at_low_usd": "523320.57",
        "loss_at_high_usd": "523320.57",
        "swing_usd": "0.00",
        "base_loss_usd": "523320.57"
      }
    ],
    "grid": {
      "x_param": "usde_spot_shock_pct",
      "x_values": [
        "0.0000",
        "-0.0200",
        "-0.0400",
        "-0.0600",
        "-0.0800",
        "-0.1000",
        "-0.1200",
        "-0.1400",
        "-0.1600",
        "-0.1800",
        "-0.2000",
        "-0.2200",
        "-0.2400",
        "-0.2600",
        "-0.2800",
        "-0.3000",
        "-0.3200",
        "-0.3400",
        "-0.3600",
        "-0.3800",
        "-0.4000"
      ],
      "y_param": "oracle_pass_through_override",
      "y_values": [
        "0.0000",
        "0.2500",
        "0.5000",
        "0.7500",
        "1.0000"
      ],
      "loss_usd": [
        [
          "24545.07",
          "224055.27",
          "423565.47",
          "623075.67",
          "822585.87",
          "1022096.08",
          "1221606.28",
          "1421116.48",
          "1620626.68",
          "1820136.88",
          "2019647.08",
          "2219157.28",
          "2418667.49",
          "2618177.69",
          "2817687.89",
          "3017198.09",
          "3216708.29",
          "3416218.49",
          "3615728.69",
          "3815238.90",
          "4014749.10"
        ],
        [
          "24545.07",
          "224055.27",
          "423565.47",
          "623075.67",
          "822585.87",
          "1022096.08",
          "1221606.28",
          "1421116.48",
          "1620626.68",
          "1820136.88",
          "2019647.08",
          "2219157.28",
          "2418667.49",
          "2618177.69",